{
  "$schema": "https://json-schema.org/draft/2020-12/schema",
  "$id": "https://gorp.dev/specs/runtime/promotion-record.schema.json",
  "title": "Gorp Promotion Record",
  "description": "Wave D contract. Immutable record of one successful promotion, written exactly once by `gorp promote` after the cherry-pick lands. Conflicted or blocked promotions produce no promotion record (they fail closed with no partial application). Linked to the approving decision by reviewDecisionSha256 and to the exact artifact by promotedCommit.",
  "type": "object",
  "additionalProperties": false,
  "required": [
    "schemaVersion",
    "graphId",
    "nodeId",
    "runId",
    "baseCommit",
    "promotedCommit",
    "resultCommit",
    "reviewDecisionSha256",
    "promotedBy",
    "promotedAt"
  ],
  "properties": {
    "schemaVersion": { "type": "integer", "const": 1 },
    "graphId": { "$ref": "#/$defs/stableId" },
    "nodeId": { "$ref": "#/$defs/stableId" },
    "runId": { "$ref": "#/$defs/stableId" },
    "baseCommit": {
      "type": "string",
      "minLength": 7,
      "description": "Target HEAD verified immediately before the cherry-pick (equals the graph's recorded baseCommit)."
    },
    "promotedCommit": {
      "type": "string",
      "pattern": "^[0-9a-f]{40}$",
      "description": "The exact reviewed sandbox commit that was cherry-picked (the gate's artifactHash)."
    },
    "resultCommit": {
      "type": "string",
      "pattern": "^[0-9a-f]{40}$",
      "description": "The commit created on the target branch by the cherry-pick."
    },
    "reviewDecisionSha256": {
      "type": "string",
      "pattern": "^[0-9a-f]{64}$",
      "description": "SHA-256 of the persisted review-decision file bytes at promotion time. Binds the promotion to the exact approval."
    },
    "promotedBy": { "type": "string", "minLength": 1 },
    "promotedAt": { "type": "string", "format": "date-time" }
  },
  "$defs": {
    "stableId": {
      "type": "string",
      "pattern": "^[A-Za-z0-9][A-Za-z0-9._-]{0,127}$"
    }
  }
}
