{
  "schemaVersion": 1,
  "graphId": "g-example",
  "nodeId": "node-1",
  "runId": "g-example-run-1",
  "baseCommit": "1234567890abcdef1234567890abcdef12345678",
  "promotedCommit": "a1b2c3d4e5f60718293a4b5c6d7e8f9012345678",
  "resultCommit": "8765432100fedcba8765432100fedcba87654321",
  "reviewDecisionSha256": "0f1e2d3c4b5a69788796a5b4c3d2e1f00f1e2d3c4b5a69788796a5b4c3d2e1f0",
  "promotedBy": "reviewer:op",
  "promotedAt": "2026-07-15T09:05:00.000Z"
}
